{
  "name": "Set say quest to require English input instead",
  "description": "",
  "targetLanguage": "Korean",
  "sourceLanguages": [
    "Korean",
    "English"
  ],
  "targetGroups": {},
  "replacementTemplates": {},
  "ignoredCells": [
    {"name": "quest/002/FesNyr102_00287", "id": 96, "column": 1, "forceLanguage": "English"},
    {"name": "quest/004/SubSea075_00487", "id": 54, "column": 1, "forceLanguage": "English"},
    {"name": "quest/004/SubSea075_00487", "id": 63, "column": 1, "forceLanguage": "English"},
    {"name": "quest/005/ChrHdb505_00502", "id": 58, "column": 1, "forceLanguage": "English"},
    {"name": "quest/014/BanIxa104_01497", "id": 57, "column": 1, "forceLanguage": "English"},
    {"name": "quest/014/GaiUse314_01455", "id": 109, "column": 1, "forceLanguage": "English"},
    {"name": "quest/014/SubFst122_01428", "id": 54, "column": 1, "forceLanguage": "English"},
    {"name": "quest/014/SubFst122_01428", "id": 62, "column": 1, "forceLanguage": "English"},
    {"name": "quest/014/SubWil101_01429", "id": 54, "column": 1, "forceLanguage": "English"},
    {"name": "quest/014/SubWil101_01429", "id": 62, "column": 1, "forceLanguage": "English"},
    {"name": "quest/015/BanIxa204_01507", "id": 57, "column": 1, "forceLanguage": "English"},
    {"name": "quest/015/BanIxa302_01515", "id": 59, "column": 1, "forceLanguage": "English"},
    {"name": "quest/015/BanIxa404_01501", "id": 57, "column": 1, "forceLanguage": "English"},
    {"name": "quest/015/BanIxa607_01568", "id": 58, "column": 1, "forceLanguage": "English"},
    {"name": "quest/016/HeaVna607_01656", "id": 59, "column": 1, "forceLanguage": "English"},
    {"name": "quest/016/JobSch560_01674", "id": 65, "column": 1, "forceLanguage": "English"},
    {"name": "quest/019/HeaVnz706_01910", "id": 68, "column": 1, "forceLanguage": "English"},
    {"name": "quest/019/HeaVnz905_01970", "id": 88, "column": 1, "forceLanguage": "English"},
    {"name": "quest/019/HeaVnz905_01970", "id": 89, "column": 1, "forceLanguage": "English"},
    {"name": "quest/020/JobDrk500_02058", "id": 55, "column": 1, "forceLanguage": "English"},
    {"name": "quest/022/BanGna003_02257", "id": 108, "column": 1, "forceLanguage": "English"},
    {"name": "quest/022/BanGna602_02277", "id": 54, "column": 1, "forceLanguage": "English"},
    {"name": "quest/022/BanMog202_02295", "id": 61, "column": 1, "forceLanguage": "English"},
    {"name": "quest/022/ChrEnd204_02210", "id": 64, "column": 1, "forceLanguage": "English"},
    {"name": "quest/025/JobPld680_02574", "id": 120, "column": 1, "forceLanguage": "English"},
    {"name": "quest/025/StmBda401_02500", "id": 96, "column": 1, "forceLanguage": "English"},
    {"name": "quest/026/StmBdz217_02689", "id": 85, "column": 1, "forceLanguage": "English"},
    {"name": "quest/026/StmBdz223_02695", "id": 55, "column": 1, "forceLanguage": "English"},
    {"name": "quest/027/StmBdz506_02757", "id": 54, "column": 1, "forceLanguage": "English"},
    {"name": "quest/028/StmBdz908_02864", "id": 60, "column": 1, "forceLanguage": "English"},
    {"name": "quest/029/BanKjn401_02985", "id": 50, "column": 1, "forceLanguage": "English"},
    {"name": "quest/030/FesHlw402_03012", "id": 66, "column": 1, "forceLanguage": "English"},
    {"name": "quest/031/BanNam302_03104", "id": 65, "column": 1, "forceLanguage": "English"},
    {"name": "quest/032/FesEst502_03203", "id": 87, "column": 1, "forceLanguage": "English"},
    {"name": "quest/032/FesEst503_03204", "id": 82, "column": 1, "forceLanguage": "English"},
    {"name": "quest/032/LucKbc005_03214", "id": 144, "column": 1, "forceLanguage": "English"},
    {"name": "quest/032/LucKbc012_03221", "id": 140, "column": 1, "forceLanguage": "English"},
    {"name": "quest/032/LucKla302_03234", "id": 63, "column": 1, "forceLanguage": "English"},
    {"name": "quest/033/LucKmb109_03310", "id": 76, "column": 1, "forceLanguage": "English"},
    {"name": "quest/033/LucKmb109_03310", "id": 81, "column": 1, "forceLanguage": "English"},
    {"name": "quest/033/LucKmb109_03310", "id": 84, "column": 1, "forceLanguage": "English"},
    {"name": "quest/033/LucKmc104_03325", "id": 106, "column": 1, "forceLanguage": "English"},
    {"name": "quest/033/LucKza016_03358", "id": 57, "column": 1, "forceLanguage": "English"},
    {"name": "quest/033/LucKzc012_03395", "id": 56, "column": 1, "forceLanguage": "English"},
    {"name": "quest/033/LucKzc014_03397", "id": 60, "column": 1, "forceLanguage": "English"},
    {"name": "quest/034/LucKzd019_03426", "id": 57, "column": 1, "forceLanguage": "English"},
    {"name": "quest/034/LucKze007_03441", "id": 55, "column": 1, "forceLanguage": "English"},
    {"name": "quest/034/LucKze007_03441", "id": 62, "column": 1, "forceLanguage": "English"},
    {"name": "quest/034/LucKze010_03444", "id": 55, "column": 1, "forceLanguage": "English"},
    {"name": "quest/035/LucKzi014_03550", "id": 57, "column": 1, "forceLanguage": "English"},
    {"name": "quest/036/BanPix103_03691", "id": 64, "column": 1, "forceLanguage": "English"},
    {"name": "quest/037/BanPix124_03712", "id": 59, "column": 1, "forceLanguage": "English"},
    {"name": "quest/038/BanQiq114_03819", "id": 57, "column": 1, "forceLanguage": "English"},
    {"name": "quest/039/BanDwa108_03909", "id": 65, "column": 1, "forceLanguage": "English"},
    {"name": "quest/039/LucKra304_03978", "id": 141, "column": 1, "forceLanguage": "English"},
    {"name": "quest/039/LucKta301_03952", "id": 101, "column": 1, "forceLanguage": "English"},
    {"name": "quest/042/AktKze002_04241", "id": 52, "column": 1, "forceLanguage": "English"},
    {"name": "quest/042/AktKze013_04252", "id": 55, "column": 1, "forceLanguage": "English"},
    {"name": "quest/042/AktKzf007_04262", "id": 54, "column": 1, "forceLanguage": "English"},
    {"name": "quest/043/AktKzi002_04317", "id": 65, "column": 1, "forceLanguage": "English"},
    {"name": "quest/043/AktKzj008_04344", "id": 57, "column": 1, "forceLanguage": "English"},
    {"name": "quest/044/AktKme107_04425", "id": 135, "column": 1, "forceLanguage": "English"},
    {"name": "quest/044/AktKme107_04425", "id": 142, "column": 1, "forceLanguage": "English"}
  ],
  "rules": []
}